{
  "schema_version": 1,
  "run_id": "3f2b9c1e-6d4a-4c0b-9e1f-0a1b2c3d4e5f",
  "conv_id": "conv-hacker-01",
  "profile_id": "hacker",
  "ducky_name": "Hacker",
  "model": "anthropic:claude-sonnet-5",
  "coding_agent": "ducky",
  "group_id": "conv-hub-01",
  "leader_conv_id": "conv-architect-01",
  "source": "agent",
  "lane": { "write_allowed": ["Content/Verse/Shop/**"] },
  "started": 1757250000.125,
  "ended": 1757250042.5,
  "status": "done",
  "seen": {
    "Content/Verse/Shop/shop.verse": { "hash": "9a1f3c5e7b2d4f60", "ts": 1757250001.0 }
  },
  "entries": [
    {
      "seq": 1,
      "ts": 1757250010.0,
      "path": "Content/Verse/Shop/shop.verse",
      "op": "write",
      "from_path": null,
      "trash_token": null,
      "tool": "workspace_write_file",
      "before_hash": "9a1f3c5e7b2d4f60",
      "after_hash": "0b2c4d6e8f1a3c5e",
      "before_entry_id": "1757250009990",
      "after_entry_id": "1757250010001",
      "before_blob": "9a1f3c5e7b2d4f60",
      "after_blob": "0b2c4d6e8f1a3c5e",
      "lines_added": 12,
      "lines_removed": 3,
      "in_lane": true,
      "conflict": null,
      "reverted": false,
      "reverted_by_run": null
    },
    {
      "seq": 2,
      "ts": 1757250030.0,
      "path": "Content/Verse/Shop/shop_ui.verse",
      "op": "create",
      "from_path": null,
      "trash_token": null,
      "tool": "create_project_verse_file",
      "before_hash": "",
      "after_hash": "1c3e5a7b9d2f4e60",
      "before_entry_id": null,
      "after_entry_id": "1757250030002",
      "before_blob": null,
      "after_blob": "1c3e5a7b9d2f4e60",
      "lines_added": 40,
      "lines_removed": 0,
      "in_lane": true,
      "conflict": {
        "kind": "concurrent_writer",
        "other_run_id": "7e8d9c0b-1a2b-4c3d-8e9f-0a1b2c3d4e5f",
        "other_conv_id": "conv-solo-02",
        "other_ducky": "Ducky",
        "expected_hash": "",
        "found_hash": ""
      },
      "reverted": false,
      "reverted_by_run": null
    }
  ]
}
